Date,Name,Year,Letterboxd URI,Rating,Rewatch,Review,Tags,Watched Date
2023-08-07,The Crowded Room,2023,https://boxd.it/4EAKsz,4.5,,"No entiendo las críticas ""especializadas"". Una maravilla de serie, profunda, intimista, con actuaciones soberbias.",,2023-08-06
2023-11-20,Inseparables,2016,https://boxd.it/5bB6P3,3.5,,"Es que Rodrigo de la Serna bailando ""Bombón asesino"" no ayuda para que yo lo ame menos.",,2023-11-19
2023-12-20,A Perfect Story,2023,https://boxd.it/5m50GJ,5,Yes,Te llena el corazón de sentimientos bonitos ❤️,,2023-12-19
2024-01-20,Alcatraz,2018,https://boxd.it/5DlY4v,2.5,,"Buen comienzo, regular desarrollo, pésima cancelación.",,2024-01-06
2024-05-30,Maxton Hall: The World Between Us,2024,https://boxd.it/6zye6N,4,,Sólo soy una chica llorando con todas las historias de <i>enemies to lovers<i> que vea.,,2024-05-29
